[
  {
    "blurb": null,
    "confidence": "wiki",
    "data_gaps": [],
    "former_ids": [],
    "game_version": null,
    "greenhouse_ok": null,
    "growth_days": 14,
    "icon_key": "crop/apple",
    "id": "apple",
    "id_status": "provisional",
    "is_trellis": null,
    "name": "Apple",
    "numeric_id": null,
    "numeric_id_game_version": null,
    "produce_item_id": "apple",
    "prov": {
      "*": "wiki_cargo"
    },
    "quality_enabled": null,
    "regrow_days": 3,
    "seasons": [
      "fall"
    ],
    "seed_item_id": "sapling_apple",
    "seed_sources": [],
    "version_added": null,
    "wiki_page": "Apple",
    "yield": null
  },
  {
    "blurb": null,
    "confidence": "wiki",
    "data_gaps": [],
    "former_ids": [],
    "game_version": null,
    "greenhouse_ok": null,
    "growth_days": 5,
    "icon_key": "crop/basil",
    "id": "basil",
    "id_status": "provisional",
    "is_trellis": null,
    "name": "Basil",
    "numeric_id": null,
    "numeric_id_game_version": null,
    "produce_item_id": "basil",
    "prov": {
      "*": "wiki_cargo"
    },
    "quality_enabled": null,
    "regrow_days": 3,
    "seasons": [
      "summer"
    ],
    "seed_item_id": "seed_basil",
    "seed_sources": [],
    "version_added": null,
    "wiki_page": "Basil",
    "yield": null
  },
  {
    "blurb": null,
    "confidence": "wiki",
    "data_gaps": [],
    "former_ids": [],
    "game_version": null,
    "greenhouse_ok": null,
    "growth_days": 4,
    "icon_key": "crop/beet",
    "id": "beet",
    "id_status": "provisional",
    "is_trellis": null,
    "name": "Beet",
    "numeric_id": null,
    "numeric_id_game_version": null,
    "produce_item_id": "beet",
    "prov": {
      "*": "wiki_cargo"
    },
    "quality_enabled": null,
    "regrow_days": null,
    "seasons": [
      "winter"
    ],
    "seed_item_id": "seed_beet",
    "seed_sources": [],
    "version_added": null,
    "wiki_page": "Beet",
    "yield": null
  },
  {
    "blurb": null,
    "confidence": "wiki",
    "data_gaps": [],
    "former_ids": [],
    "game_version": null,
    "greenhouse_ok": null,
    "growth_days": 6,
    "icon_key": "crop/broccoli",
    "id": "broccoli",
    "id_status": "provisional",
    "is_trellis": null,
    "name": "Broccoli",
    "numeric_id": null,
    "numeric_id_game_version": null,
    "produce_item_id": "broccoli",
    "prov": {
      "*": "wiki_cargo"
    },
    "quality_enabled": null,
    "regrow_days": null,
    "seasons": [
      "fall"
    ],
    "seed_item_id": "seed_broccoli",
    "seed_sources": [],
    "version_added": null,
    "wiki_page": "Broccoli",
    "yield": null
  },
  {
    "blurb": null,
    "confidence": "wiki",
    "data_gaps": [
      "seed_item_id"
    ],
    "former_ids": [],
    "game_version": null,
    "greenhouse_ok": null,
    "growth_days": 5,
    "icon_key": "crop/burdock_root",
    "id": "burdock_root",
    "id_status": "provisional",
    "is_trellis": null,
    "name": "Burdock Root",
    "numeric_id": null,
    "numeric_id_game_version": null,
    "produce_item_id": "burdock_root",
    "prov": {
      "*": "wiki_cargo"
    },
    "quality_enabled": null,
    "regrow_days": 3,
    "seasons": [
      "winter"
    ],
    "seed_item_id": null,
    "seed_sources": [],
    "version_added": null,
    "wiki_page": "Burdock_Root",
    "yield": null
  },
  {
    "blurb": null,
    "confidence": "wiki",
    "data_gaps": [],
    "former_ids": [],
    "game_version": null,
    "greenhouse_ok": null,
    "growth_days": 9,
    "icon_key": "crop/cabbage",
    "id": "cabbage",
    "id_status": "provisional",
    "is_trellis": null,
    "name": "Cabbage",
    "numeric_id": null,
    "numeric_id_game_version": null,
    "produce_item_id": "cabbage",
    "prov": {
      "*": "wiki_cargo"
    },
    "quality_enabled": null,
    "regrow_days": null,
    "seasons": [
      "spring"
    ],
    "seed_item_id": "seed_cabbage",
    "seed_sources": [],
    "version_added": null,
    "wiki_page": "Cabbage",
    "yield": null
  },
  {
    "blurb": null,
    "confidence": "wiki",
    "data_gaps": [],
    "former_ids": [],
    "game_version": null,
    "greenhouse_ok": null,
    "growth_days": 6,
    "icon_key": "crop/carrot",
    "id": "carrot",
    "id_status": "provisional",
    "is_trellis": null,
    "name": "Carrot",
    "numeric_id": null,
    "numeric_id_game_version": null,
    "produce_item_id": "carrot",
    "prov": {
      "*": "wiki_cargo"
    },
    "quality_enabled": null,
    "regrow_days": null,
    "seasons": [
      "spring"
    ],
    "seed_item_id": "seed_carrot",
    "seed_sources": [],
    "version_added": null,
    "wiki_page": "Carrot",
    "yield": null
  },
  {
    "blurb": null,
    "confidence": "wiki",
    "data_gaps": [],
    "former_ids": [],
    "game_version": null,
    "greenhouse_ok": null,
    "growth_days": 6,
    "icon_key": "crop/catmint",
    "id": "catmint",
    "id_status": "provisional",
    "is_trellis": null,
    "name": "Catmint",
    "numeric_id": null,
    "numeric_id_game_version": null,
    "produce_item_id": "catmint",
    "prov": {
      "*": "wiki_cargo"
    },
    "quality_enabled": null,
    "regrow_days": null,
    "seasons": [
      "summer"
    ],
    "seed_item_id": "seed_catmint",
    "seed_sources": [],
    "version_added": null,
    "wiki_page": "Catmint",
    "yield": null
  },
  {
    "blurb": null,
    "confidence": "wiki",
    "data_gaps": [],
    "former_ids": [],
    "game_version": null,
    "greenhouse_ok": null,
    "growth_days": 6,
    "icon_key": "crop/cauliflower",
    "id": "cauliflower",
    "id_status": "provisional",
    "is_trellis": null,
    "name": "Cauliflower",
    "numeric_id": null,
    "numeric_id_game_version": null,
    "produce_item_id": "cauliflower",
    "prov": {
      "*": "wiki_cargo"
    },
    "quality_enabled": null,
    "regrow_days": null,
    "seasons": [
      "winter"
    ],
    "seed_item_id": "seed_cauliflower",
    "seed_sources": [],
    "version_added": null,
    "wiki_page": "Cauliflower",
    "yield": null
  },
  {
    "blurb": null,
    "confidence": "wiki",
    "data_gaps": [],
    "former_ids": [],
    "game_version": null,
    "greenhouse_ok": null,
    "growth_days": 4,
    "icon_key": "crop/celosia",
    "id": "celosia",
    "id_status": "provisional",
    "is_trellis": null,
    "name": "Celosia",
    "numeric_id": null,
    "numeric_id_game_version": null,
    "produce_item_id": "celosia",
    "prov": {
      "*": "wiki_cargo"
    },
    "quality_enabled": null,
    "regrow_days": null,
    "seasons": [
      "fall"
    ],
    "seed_item_id": "seed_celosia",
    "seed_sources": [],
    "version_added": null,
    "wiki_page": "Celosia",
    "yield": null
  },
  {
    "blurb": null,
    "confidence": "wiki",
    "data_gaps": [],
    "former_ids": [],
    "game_version": null,
    "greenhouse_ok": null,
    "growth_days": 14,
    "icon_key": "crop/cherry",
    "id": "cherry",
    "id_status": "provisional",
    "is_trellis": null,
    "name": "Cherry",
    "numeric_id": null,
    "numeric_id_game_version": null,
    "produce_item_id": "cherry",
    "prov": {
      "*": "wiki_cargo"
    },
    "quality_enabled": null,
    "regrow_days": 3,
    "seasons": [
      "spring"
    ],
    "seed_item_id": "sapling_cherry",
    "seed_sources": [],
    "version_added": null,
    "wiki_page": "Cherry",
    "yield": null
  },
  {
    "blurb": null,
    "confidence": "wiki",
    "data_gaps": [],
    "former_ids": [],
    "game_version": null,
    "greenhouse_ok": null,
    "growth_days": 5,
    "icon_key": "crop/chickpea",
    "id": "chickpea",
    "id_status": "provisional",
    "is_trellis": null,
    "name": "Chickpea",
    "numeric_id": null,
    "numeric_id_game_version": null,
    "produce_item_id": "chickpea",
    "prov": {
      "*": "wiki_cargo"
    },
    "quality_enabled": null,
    "regrow_days": 3,
    "seasons": [
      "spring"
    ],
    "seed_item_id": "seed_chickpea",
    "seed_sources": [],
    "version_added": null,
    "wiki_page": "Chickpea",
    "yield": null
  },
  {
    "blurb": null,
    "confidence": "wiki",
    "data_gaps": [],
    "former_ids": [],
    "game_version": null,
    "greenhouse_ok": null,
    "growth_days": 6,
    "icon_key": "crop/chili_pepper",
    "id": "chili_pepper",
    "id_status": "provisional",
    "is_trellis": null,
    "name": "Chili Pepper",
    "numeric_id": null,
    "numeric_id_game_version": null,
    "produce_item_id": "chili_pepper",
    "prov": {
      "*": "wiki_cargo"
    },
    "quality_enabled": null,
    "regrow_days": null,
    "seasons": [
      "summer"
    ],
    "seed_item_id": "seed_chili_pepper",
    "seed_sources": [],
    "version_added": null,
    "wiki_page": "Chili_Pepper",
    "yield": null
  },
  {
    "blurb": null,
    "confidence": "wiki",
    "data_gaps": [],
    "former_ids": [],
    "game_version": null,
    "greenhouse_ok": null,
    "growth_days": 6,
    "icon_key": "crop/chrysanthemum",
    "id": "chrysanthemum",
    "id_status": "provisional",
    "is_trellis": null,
    "name": "Chrysanthemum",
    "numeric_id": null,
    "numeric_id_game_version": null,
    "produce_item_id": "chrysanthemum",
    "prov": {
      "*": "wiki_cargo"
    },
    "quality_enabled": null,
    "regrow_days": null,
    "seasons": [
      "fall"
    ],
    "seed_item_id": "seed_chrysanthemum",
    "seed_sources": [],
    "version_added": null,
    "wiki_page": "Chrysanthemum",
    "yield": null
  },
  {
    "blurb": null,
    "confidence": "wiki",
    "data_gaps": [],
    "former_ids": [],
    "game_version": null,
    "greenhouse_ok": null,
    "growth_days": 5,
    "icon_key": "crop/corn",
    "id": "corn",
    "id_status": "provisional",
    "is_trellis": null,
    "name": "Corn",
    "numeric_id": null,
    "numeric_id_game_version": null,
    "produce_item_id": "corn",
    "prov": {
      "*": "wiki_cargo"
    },
    "quality_enabled": null,
    "regrow_days": 3,
    "seasons": [
      "summer"
    ],